{
  "required" : true ,
  "$schema" : "http://json-schema.org/draft-03/schema" ,
  "type" : "object" ,
  "properties" : {
    "id" : {
      "type" : "string" ,
      "required" : false
    } ,
    "status" : {
      "type" : "string" ,
      "required" : false
    } ,
    "bank_account_id" : {
      "type" : "string" ,
      "required" : false
    } ,
    "initiated_at" : {
      "type" : "string" ,
      "required" : false
    } ,
    "total_money" : {
      "type" : "object" ,
      "required" : false ,
      "properties" : {
        "amount" : {
          "type" : "number" ,
          "required" : false
        } ,
        "currency_code" : {
          "type" : "string" ,
          "required" : false
        }
      }
    } ,
    "entries" : {
      "type" : "array" ,
      "required" : false ,
      "items" : [
        {
          "type" : "object" ,
          "properties" : {
            "payment_id" : {
              "type" : "string" ,
              "required" : false
            } ,
            "type" : {
              "type" : "string" ,
              "required" : false
            } ,
            "amount_money" : {
              "type" : "object" ,
              "required" : false ,
              "properties" : {
                "amount" : {
                  "type" : "number" ,
                  "required" : false
                } ,
                "currency_code" : {
                  "type" : "string" ,
                  "required" : false
                }
              }
            } ,
            "fee_money" : {
              "type" : "object" ,
              "required" : false ,
              "properties" : {
                "amount" : {
                  "type" : "number" ,
                  "required" : false
                } ,
                "currency_code" : {
                  "type" : "string" ,
                  "required" : false
                }
              }
            }
          }
        }
      ]
    }
  }
}